[
  {
    "signal_type": "urgency",
    "value": 0.91,
    "confidence": 0.91,
    "source_ref": "fixture",
    "evidence_span": {"start": 0, "end": 45},
    "redacted_quote": "you must transfer the amount immediately or your account will be ***"
  },
  {
    "signal_type": "authority_impersonation",
    "value": 0.85,
    "confidence": 0.85,
    "source_ref": "fixture",
    "evidence_span": {"start": 50, "end": 110},
    "redacted_quote": "this is officer *** from the RBI fraud prevention department"
  },
  {
    "signal_type": "payment_redirect",
    "value": 0.88,
    "confidence": 0.88,
    "source_ref": "fixture",
    "evidence_span": {"start": 120, "end": 180},
    "redacted_quote": "transfer your funds to this safe account *** for protection"
  },
  {
    "signal_type": "secrecy_request",
    "value": 0.72,
    "confidence": 0.72,
    "source_ref": "fixture",
    "evidence_span": {"start": 200, "end": 260},
    "redacted_quote": "do not tell anyone about this call it is a confidential investigation"
  },
  {
    "signal_type": "threat",
    "value": 0.79,
    "confidence": 0.79,
    "source_ref": "fixture",
    "evidence_span": {"start": 270, "end": 330},
    "redacted_quote": "if you do not comply we will be forced to freeze all your accounts and issue an arrest warrant"
  },
  {
    "signal_type": "otp_request",
    "value": 0.65,
    "confidence": 0.65,
    "source_ref": "fixture",
    "evidence_span": {"start": 340, "end": 380},
    "redacted_quote": "please share the OTP you just received on ***"
  }
]
